{"artifact_source":"same-scenario-fallback","case_id":"revision","claim_boundary":"SIMULATED TEACHING DATA / NOT LIVE / NOT MEASURED / NOT CANONICAL-PARITY-VERIFIED","clock":{"duration_s":180,"step_s":10},"contract_version":"lora-energy-endpoint-replay-v1","endpoint_replay_id":"sha256:4bcf8e3fde599b5903a07ea62a07ea12b513f49f5be13e80ec61d83f708dde88","endpoint_replay_input_id":"sha256:b552bcda5a34d7ac911ae494894e3907cecb408493e794c03c232e660954eebc","energy_scope":"endpoint-radio-and-processing-course-assumptions","frames":[{"action":null,"contact_id":null,"cumulative_endpoint_energy_j":0,"elapsed_s":0,"frame_index":0,"packet_event_ids":["evt-0000"],"quality_band":0,"queue_packet_ids":["normal-1"],"radio_state":"SLEEP","service_pass":false},{"action":"SLEEP","contact_id":null,"cumulative_endpoint_energy_j":0,"elapsed_s":0,"frame_index":1,"packet_event_ids":[],"quality_band":0,"queue_packet_ids":["normal-1"],"radio_state":"SLEEP","service_pass":false},{"action":"SLEEP","contact_id":null,"cumulative_endpoint_energy_j":0.01,"elapsed_s":10,"frame_index":2,"packet_event_ids":[],"quality_band":0,"queue_packet_ids":["normal-1"],"radio_state":"SLEEP","service_pass":false},{"action":"WAIT","contact_id":"contact-a","cumulative_endpoint_energy_j":0.01,"elapsed_s":10,"frame_index":3,"packet_event_ids":[],"quality_band":1,"queue_packet_ids":["normal-1"],"radio_state":"SLEEP","service_pass":false},{"action":"WAIT","contact_id":"contact-a","cumulative_endpoint_energy_j":0.51,"elapsed_s":20,"frame_index":4,"packet_event_ids":[],"quality_band":1,"queue_packet_ids":["normal-1"],"radio_state":"AWAKE_IDLE","service_pass":false},{"action":"WAIT","contact_id":"contact-a","cumulative_endpoint_energy_j":0.51,"elapsed_s":20,"frame_index":5,"packet_event_ids":["evt-0005"],"quality_band":2,"queue_packet_ids":["normal-1","normal-2"],"radio_state":"AWAKE_IDLE","service_pass":false},{"action":"WAIT","contact_id":"contact-a","cumulative_endpoint_energy_j":0.51,"elapsed_s":20,"frame_index":6,"packet_event_ids":[],"quality_band":2,"queue_packet_ids":["normal-1","normal-2"],"radio_state":"AWAKE_IDLE","service_pass":false},{"action":"SEND_ONE","contact_id":"contact-a","cumulative_endpoint_energy_j":0.51,"elapsed_s":20,"frame_index":7,"packet_event_ids":[],"quality_band":2,"queue_packet_ids":["normal-1","normal-2"],"radio_state":"AWAKE_IDLE","service_pass":false},{"action":"SEND_ONE","contact_id":"contact-a","cumulative_endpoint_energy_j":0.59,"elapsed_s":21,"frame_index":8,"packet_event_ids":[],"quality_band":2,"queue_packet_ids":["normal-1","normal-2"],"radio_state":"PROCESS","service_pass":false},{"action":"SEND_ONE","contact_id":"contact-a","cumulative_endpoint_energy_j":1.79,"elapsed_s":23,"frame_index":9,"packet_event_ids":[],"quality_band":2,"queue_packet_ids":["normal-1","normal-2"],"radio_state":"TX","service_pass":false},{"action":"SEND_ONE","contact_id":"contact-a","cumulative_endpoint_energy_j":1.91,"elapsed_s":24,"frame_index":10,"packet_event_ids":[],"quality_band":2,"queue_packet_ids":["normal-1","normal-2"],"radio_state":"RX","service_pass":false},{"action":"SEND_ONE","contact_id":"contact-a","cumulative_endpoint_energy_j":1.91,"elapsed_s":24,"frame_index":11,"packet_event_ids":["evt-0011"],"quality_band":2,"queue_packet_ids":["normal-1","normal-2"],"radio_state":"RX","service_pass":false},{"action":"SEND_ONE","contact_id":"contact-a","cumulative_endpoint_energy_j":1.91,"elapsed_s":24,"frame_index":12,"packet_event_ids":["evt-0012"],"quality_band":2,"queue_packet_ids":["normal-2"],"radio_state":"RX","service_pass":false},{"action":"WAIT","contact_id":"contact-a","cumulative_endpoint_energy_j":1.91,"elapsed_s":30,"frame_index":13,"packet_event_ids":[],"quality_band":3,"queue_packet_ids":["normal-2"],"radio_state":"RX","service_pass":false},{"action":"WAIT","contact_id":"contact-a","cumulative_endpoint_energy_j":2.41,"elapsed_s":40,"frame_index":14,"packet_event_ids":[],"quality_band":3,"queue_packet_ids":["normal-2"],"radio_state":"AWAKE_IDLE","service_pass":false},{"action":"WAIT","contact_id":"contact-a","cumulative_endpoint_energy_j":2.41,"elapsed_s":40,"frame_index":15,"packet_event_ids":["evt-0015"],"quality_band":2,"queue_packet_ids":["normal-2","bulk-1"],"radio_state":"AWAKE_IDLE","service_pass":false},{"action":"WAIT","contact_id":"contact-a","cumulative_endpoint_energy_j":2.41,"elapsed_s":40,"frame_index":16,"packet_event_ids":[],"quality_band":2,"queue_packet_ids":["normal-2","bulk-1"],"radio_state":"AWAKE_IDLE","service_pass":false},{"action":"WAIT","contact_id":"contact-a","cumulative_endpoint_energy_j":2.91,"elapsed_s":50,"frame_index":17,"packet_event_ids":[],"quality_band":2,"queue_packet_ids":["normal-2","bulk-1"],"radio_state":"AWAKE_IDLE","service_pass":false},{"action":"SEND_ONE","contact_id":"contact-a","cumulative_endpoint_energy_j":2.91,"elapsed_s":50,"frame_index":18,"packet_event_ids":[],"quality_band":1,"queue_packet_ids":["normal-2","bulk-1"],"radio_state":"AWAKE_IDLE","service_pass":false},{"action":"SEND_ONE","contact_id":"contact-a","cumulative_endpoint_energy_j":2.99,"elapsed_s":51,"frame_index":19,"packet_event_ids":[],"quality_band":1,"queue_packet_ids":["normal-2","bulk-1"],"radio_state":"PROCESS","service_pass":false},{"action":"SEND_ONE","contact_id":"contact-a","cumulative_endpoint_energy_j":4.19,"elapsed_s":53,"frame_index":20,"packet_event_ids":[],"quality_band":1,"queue_packet_ids":["normal-2","bulk-1"],"radio_state":"TX","service_pass":false},{"action":"SEND_ONE","contact_id":"contact-a","cumulative_endpoint_energy_j":4.31,"elapsed_s":54,"frame_index":21,"packet_event_ids":[],"quality_band":1,"queue_packet_ids":["normal-2","bulk-1"],"radio_state":"RX","service_pass":false},{"action":"SEND_ONE","contact_id":"contact-a","cumulative_endpoint_energy_j":4.31,"elapsed_s":54,"frame_index":22,"packet_event_ids":["evt-0022"],"quality_band":1,"queue_packet_ids":["normal-2","bulk-1"],"radio_state":"RX","service_pass":false},{"action":"SEND_ONE","contact_id":"contact-a","cumulative_endpoint_energy_j":4.31,"elapsed_s":54,"frame_index":23,"packet_event_ids":["evt-0023"],"quality_band":1,"queue_packet_ids":["bulk-1"],"radio_state":"RX","service_pass":false},{"action":"WAIT","contact_id":"contact-a","cumulative_endpoint_energy_j":4.31,"elapsed_s":60,"frame_index":24,"packet_event_ids":[],"quality_band":2,"queue_packet_ids":["bulk-1"],"radio_state":"RX","service_pass":false},{"action":"WAIT","contact_id":"contact-a","cumulative_endpoint_energy_j":4.81,"elapsed_s":70,"frame_index":25,"packet_event_ids":[],"quality_band":2,"queue_packet_ids":["bulk-1"],"radio_state":"AWAKE_IDLE","service_pass":false},{"action":"WAIT","contact_id":"contact-a","cumulative_endpoint_energy_j":4.81,"elapsed_s":70,"frame_index":26,"packet_event_ids":["evt-0026"],"quality_band":1,"queue_packet_ids":["bulk-1","urgent-1"],"radio_state":"AWAKE_IDLE","service_pass":false},{"action":"WAIT","contact_id":"contact-a","cumulative_endpoint_energy_j":4.81,"elapsed_s":70,"frame_index":27,"packet_event_ids":[],"quality_band":1,"queue_packet_ids":["bulk-1","urgent-1"],"radio_state":"AWAKE_IDLE","service_pass":false},{"action":"WAIT","contact_id":"contact-a","cumulative_endpoint_energy_j":5.31,"elapsed_s":80,"frame_index":28,"packet_event_ids":[],"quality_band":1,"queue_packet_ids":["bulk-1","urgent-1"],"radio_state":"AWAKE_IDLE","service_pass":false},{"action":"WAIT","contact_id":null,"cumulative_endpoint_energy_j":5.31,"elapsed_s":80,"frame_index":29,"packet_event_ids":[],"quality_band":0,"queue_packet_ids":["bulk-1","urgent-1"],"radio_state":"AWAKE_IDLE","service_pass":false},{"action":"SLEEP","contact_id":null,"cumulative_endpoint_energy_j":5.31,"elapsed_s":80,"frame_index":30,"packet_event_ids":[],"quality_band":0,"queue_packet_ids":["bulk-1","urgent-1"],"radio_state":"AWAKE_IDLE","service_pass":false},{"action":"SLEEP","contact_id":null,"cumulative_endpoint_energy_j":5.32,"elapsed_s":90,"frame_index":31,"packet_event_ids":[],"quality_band":0,"queue_packet_ids":["bulk-1","urgent-1"],"radio_state":"SLEEP","service_pass":false},{"action":"SLEEP","contact_id":null,"cumulative_endpoint_energy_j":5.32,"elapsed_s":90,"frame_index":32,"packet_event_ids":[],"quality_band":0,"queue_packet_ids":["bulk-1","urgent-1"],"radio_state":"SLEEP","service_pass":false},{"action":"SLEEP","contact_id":null,"cumulative_endpoint_energy_j":5.33,"elapsed_s":100,"frame_index":33,"packet_event_ids":[],"quality_band":0,"queue_packet_ids":["bulk-1","urgent-1"],"radio_state":"SLEEP","service_pass":false},{"action":"SEND_URGENT","contact_id":"contact-b","cumulative_endpoint_energy_j":5.33,"elapsed_s":100,"frame_index":34,"packet_event_ids":[],"quality_band":1,"queue_packet_ids":["bulk-1","urgent-1"],"radio_state":"SLEEP","service_pass":false},{"action":"SEND_URGENT","contact_id":"contact-b","cumulative_endpoint_energy_j":5.35,"elapsed_s":101,"frame_index":35,"packet_event_ids":[],"quality_band":1,"queue_packet_ids":["bulk-1","urgent-1"],"radio_state":"WAKE","service_pass":false},{"action":"SEND_URGENT","contact_id":"contact-b","cumulative_endpoint_energy_j":5.43,"elapsed_s":102,"frame_index":36,"packet_event_ids":[],"quality_band":1,"queue_packet_ids":["bulk-1","urgent-1"],"radio_state":"PROCESS","service_pass":false},{"action":"SEND_URGENT","contact_id":"contact-b","cumulative_endpoint_energy_j":6.63,"elapsed_s":104,"frame_index":37,"packet_event_ids":[],"quality_band":1,"queue_packet_ids":["bulk-1","urgent-1"],"radio_state":"TX","service_pass":false},{"action":"SEND_URGENT","contact_id":"contact-b","cumulative_endpoint_energy_j":6.75,"elapsed_s":105,"frame_index":38,"packet_event_ids":[],"quality_band":1,"queue_packet_ids":["bulk-1","urgent-1"],"radio_state":"RX","service_pass":false},{"action":"SEND_URGENT","contact_id":"contact-b","cumulative_endpoint_energy_j":6.75,"elapsed_s":105,"frame_index":39,"packet_event_ids":["evt-0039"],"quality_band":1,"queue_packet_ids":["bulk-1","urgent-1"],"radio_state":"RX","service_pass":false},{"action":"SEND_URGENT","contact_id":"contac